{
  "$defs": {
    "Address": {
      "additionalProperties": false,
      "properties": {
        "city": {
          "type": "string"
        },
        "street": {
          "type": "string"
        },
        "zipCode": {
          "type": "string"
        }
      },
      "required": [
        "street",
        "city",
        "zipCode"
      ],
      "type": "object"
    },
    "Profile": {
      "additionalProperties": false,
      "properties": {
        "avatar": {
          "type": [
            "null",
            "null"
          ]
        },
        "bio": {
          "type": "string"
        },
        "socialLinks": {
          "$ref": "#/$defs/SocialLinks"
        }
      },
      "required": [
        "bio",
        "avatar",
        "socialLinks"
      ],
      "type": "object"
    },
    "Root": {
      "additionalProperties": false,
      "properties": {
        "address": {
          "$ref": "#/$defs/Address"
        },
        "age": {
          "type": "integer"
        },
        "email": {
          "type": "string"
        },
        "id": {
          "type": "integer"
        },
        "isActive": {
          "type": "boolean"
        },
        "name": {
          "type": "string"
        },
        "profile": {
          "$ref": "#/$defs/Profile"
        },
        "tags": {
          "items": {
            "type": "string"
          },
          "type": "array"
        }
      },
      "required": [
        "id",
        "name",
        "email",
        "isActive",
        "age",
        "address",
        "tags",
        "profile"
      ],
      "type": "object"
    },
    "SocialLinks": {
      "additionalProperties": false,
      "properties": {
        "github": {
          "type": "string"
        },
        "twitter": {
          "type": "string"
        }
      },
      "required": [
        "github",
        "twitter"
      ],
      "type": "object"
    }
  },
  "$schema": "https://json-schema.org/draft/2020-12/schema",
  "additionalProperties": false,
  "description": "Schema generated from plain JSON input",
  "properties": {
    "address": {
      "$ref": "#/$defs/Address"
    },
    "age": {
      "type": "integer"
    },
    "email": {
      "type": "string"
    },
    "id": {
      "type": "integer"
    },
    "isActive": {
      "type": "boolean"
    },
    "name": {
      "type": "string"
    },
    "profile": {
      "$ref": "#/$defs/Profile"
    },
    "tags": {
      "items": {
        "type": "string"
      },
      "type": "array"
    }
  },
  "required": [
    "id",
    "name",
    "email",
    "isActive",
    "age",
    "address",
    "tags",
    "profile"
  ],
  "title": "Generated from JSON",
  "type": "object"
}